<?xml version="1.0" encoding="UTF-8"?>
<pa:patient xsi:schemaLocation="http://univ-grenoble-alpes/fr/l3miage/medical/patient ../xsd/patient.xsd" xmlns:at="http://univ-grenoble-alpes/fr/l3miage/medical/acte" xmlns:cb="http://univ-grenoble-alpes/fr/l3miage/medical" xmlns:pa="http://univ-grenoble-alpes/fr/l3miage/medical/patient" xmlns:xsi="http://www.w3.org/2001/XMLSchema-instance">
    <pa:nom>Pien</pa:nom>
    <pa:prenom>Oscare</pa:prenom>
    <pa:sexe>F</pa:sexe>
    <pa:naissance>1975-03-25</pa:naissance>
    <pa:numeroSS>275037306569241</pa:numeroSS>
    <pa:adresse>
        <cb:rue>Casimir Brenier</cb:rue>
        <cb:codePostal>38000</cb:codePostal>
        <cb:ville>Grenoble</cb:ville>
    </pa:adresse>
    <pa:visite date="2015-12-08">
        <pa:intervenant>
            <pa:nom>Fréchie</pa:nom>
            <pa:prenom>Sarah</pa:prenom>
        </pa:intervenant>
        <pa:acte>
            Prélèvement par ponction veineuse directe
        </pa:acte>
        <pa:acte>
            Saignée
        </pa:acte>
    </pa:visite>
</pa:patient>
